username,full_text
pink_to4,sama sih kaya beli pc terus tambahin lampu rgb biar nambah cepat ram napa ngurusin guru honorer gaji 300 ribu bulan biar dapet gaji layak gitu
haebaragiu,gaji guru honorer 1 jam 20 ribu tugas cerdas anak bangsa
zevratycos,rendah tingkat literasi uang digital masyarakat masalah sejahtera guru jadi faktor utama jerat pinjam online ilegal dasar lapor jaring p2g daerah banyak guru honorer terima gaji bawah standar bahkan
litcookiedough,gabisa banget ngeliat ginian allah anak orang guru honorer tau banget struggle nya tua aku nyari kerja samping karna gaji cukup hari karna personil rumah banyak
keyznlh,sana guru honorer gaji bawah umk california
veautifull__,sakit hati paling akut ketika dianggep beban sama sendiri kenya anak gaji gede punya hasil banyak kerja beliau ngatur spd guru oke turutin jadi guru honorer gaji dikit banget malah bilang bensin bpjs sing bayar
ddiminssi,nilai mana guru honorer gaji cuma 350 ribu bulan
kamakiho,mungkin andai balik gaji kpu guru honorer seperti lebih adil
dnxkalzxl,fakta gaji guru honorer mostly memang dikit apa ngajar sekolah negeri banting banget liat banyak guru yang angkat pns nyekolahin sertifikasi beli mobil rumah lain
hirahoon,sender nih gimana sih tertawa fakta situ ngomong juga riset tidak semua guru dapat gaji tiap bulan apa honorer gaji 400 3 bulanmana tunjang fakta lapang apa di timur banyak banget guru yang tidak dapet gaji
17shingibanggi,jelang milu 2029 gaji naik guru honorer angkat 1 juta tahun
urmatchatalk,bom dana bos tilep oknum makin dikit dah gaji guru honorer
Over_Think_85,pajak kaoo bayar buzzer mending urus tuh gaji guru honorer
ChewbaccaSmom,berita kata memang guru paling banyak libat pinjol guru honorer tau aja gaji guru honorer berapa asli sedih guru ingin lanjut didik salah syarat naik pangkat guru tetap jadi pinjol guna biaya didik
wahyudithog,lihat komen ig guru honorer ngeluh gaji cuma 700 ribu yang reply pokok nyesuain gaya hidup kamu
sextratime,guru honorer sopir mertua guru pns habis nganter mertua sekolah lanjut sekolah naik mobil kira murid wih naik mobil padahal gaji honorer cukup beli bensin mobil bulan
zevratycos,lebih malu jabat nentuin bijak gaji guru honorer
Pret2310,banyak gaji guru memang segitu mau asn tidak gampang lulus kuliah mesti ambil ppg dulu honorer dulu ikut p3k tidak jamin terima mau gede mah ngajar sekolah swasta international sekolah punya sendiri spd ogah guru
Mambinie12,sehat guru honorer luar suka sedih dengar rekan2 sama guru harga padahal guru orang akan bentuk pimpin bangsa lanjut guru minta kasih gaji puluh juta tidak harga guru manusia
royalsq3kpau,di indonesia dipake guru pahlawan tanda jasa gaji guru honorer masih rendah dari dulu suruh ikhlas dengan alas abdi kata guru perlu makan
yogaaryow,gar bawah guru mana sudah serdik iya lumayan tunjang guru golong jabat tinggi iya gede gaji pokok guru swasta yayasan nya bagus tuntut kerja nya bagus kalau guru honorer gaji sampai
achaziraa,iya fakta nder lebih sakit anak guru susah beasiswa kira tua gaji perintah banyak asli cuma dikit apa yang honorer
Tribun_Ternate,beneran sodara kan guru honorer gaji kadang 3 bulan sekali uang gaji disatuin 3 bulan kalah sama gaji umr bulan
dariguruhonorer,gaji guru honorer daerah 1 juta bulan padahal abdi puluh 
Tribun_Ternate,nder jangan 800 200 itu rata guru honorer guru yang pns sering nunggak gaji masih kalah sama gaji kakak yang guru swasta
supersabroman10,valid guru rupa pahlawan tanda jasa apa guru honorer kaya harga diri gaji tidak pakai logika gaji gede oknum jabat yang itu tuh
Pret2310,ngapain maksa buzzer si gaji segitu mending gojek lebih banyak dapetnya masih banyak kerja yang lebih hasil mau bilang buzzer mau bilang beneran
zevratycos,nder lebih banyak guru gaji honorer gaji beneran bawah cari guru gaji cuma 2 ratus ribu kadang bayar pas uang bos cair cair 3 6 bulan sekali kerja harus semua tanggung didik anak bangsa
Lidyamuu,eh kata sbm ulang deh ukt segitu mending dokter swasta gaji guru sd kamu tau kan berapa apa honorer allah jangan mau pls
aziima27,pada ganti seragam mending gaji guru honorer
Raden__Ontoseno,memang nyata gaji guru honorer kecil dari umr kalaupun guru tetap satu sekolah swasta apa biasa hitung sendiri yang sudah asn memang gaji lumayan kerja tidak mudah bayang
_sleepwalk1ng_,percaya kampung guru jadi kerja idam masih banyak honorer gaji tak berapa
gabus_boy,banyak nambah atur kurikulum sama pakai gaji guru apa guru honorer pernah pikirin nadiem
gabus_boy,lebih penting bangun ikn naikin gaji anggota dewan makan siang gratis kaya nya banding mikirin gaji nasib guru honorer apa harga tak nila mata iblis sana insya allah bapak sangat tinggi nilai di mata tuhan yme aamiin
putralamaholot,ngeri saat gaji guru honorer bom prioritas
dariguruhonorer,2 gaji guru tadi upah bahas bagi atas miris ada guru senior tidak sertifikasi akibat sulit kejar syarat honorer senior
shylvermist,ukt 44 juta lulus guru sd honorer haji 150 ribu jadi pns gol gaji 2 5 juta negera makin ngaco
dokumenapaaja,guru honorer serang sih guru negri nohh daerah papua beneran ngajar diitung jari sisa cuman nikmat gaji jangan papua di jawa daerah pelosok guru negri beneran ngajar dateng kelas beri materi dikit banget
bimasoy,fakta memang gaji guru tuh rendah kan semua guru rejeki asn pernah ngobrol sama guru honorer sudah ngabdi 15 gaji cuma 1 5 juta padahal umr kota ku 2 juta
bebas_l,mau ikhlas kaya hati bilang adil banget kerja guru honorer bahkan shadow teacher jatohnya gaji cuma 600 khibah cair 3 bulan sekali itu bagi 2 tertawa salah banget apa nagih sumpah aku yakin tidak bakal ngasih bahkan tengah
shiningtosca,kecil tuh honorer banding kerja yang sama honor bukan guru gaji lebih gede si guru honorer
adeaahmad_a,ganti guru sakit 20 bulan gaji waktu ku minta kata si guru sebut tidak mau bayar ponakan guru sebut bilang gaji nya potong 15 juta tiap bulan nya guru honorer ganti sdg tidak pernah terima uang nya
knpharuspeduli,karena sekitar memang beneran banyak guru guru gaji bulan ratus ribu itu kadang gaji tepat waktu guru honorer tuh banget sejahtera harus enggak gaji deh manusia ekonomi ini
yogsgakuy,realitanya memang sekarang guru asn lingkung bisa hitung pake jari  honorer teman saja 4 bulan gaji turun
Teguh606Tk,ngajar sekolah swasta yang lokasi desa gaji guru honorer dapat pasu spp spp 70-90 ribu siswa tidak banyak uang kumpul bagi ngegaji guru 3 dapat tambah perintah sih tetap bawah 1 juta
Tribun_Ternate,padahal prabowo janji naik gaji guru honorer baru lantik 6 bulan datang eh saja salahin seka gaji guru rendah karna prabowo ya pelihara
bujang_lapuk10,jere misan ku gaji guru honorer 1 bulan harga 3 bolu tart jadul meanwhile bikin tart jadul 2 jam an kelar
tribungaruda12,pija hat rugi mencak mencak kartap ganti outsourcing gaji guru honorer masuk akal dam banyak diem emang enak banget makan duit haram hasil ngebajer wih mantap jangan lupa abis pura pura tobat
IsM31577000,betul lewat tiktok alvi guru honorer paksa mulung gaji cukup
KucingMermud,cobain dulu baru bikin statement kaya gitu banyak tuu guru honorer gaji 250 bulan bahkan bawah
sijuarakelas_,guru honorer pov berapa gaji 500 tante ih kecil padahal lulus s1 suami ijazah smk tembak bisa masuk usaha gaji 3 juta an lebih sejak itu ada nanya gaji jawab cukup butuh hari
akurajinnapas,rendah gaji guru honorer guru sudah angkat asn mah banyak bulan lah 5 juta masuk lagi tunjang itu
tofanprasetia,guru honorer maupun asn dapet gaji lembur sama gaji nyabarin anak tantrum soal kak bisa nyambi dilakuin
anakmamamaniez,fakta sender mandang gaji guru rendah fakta apa honorer kadang tuh gaji dibayarin 3 bulan sekali
anakmamamaniez,lihat pak nadiem pilih program briliant seragam ganti daripada gaji guru honorer desain bagaimana me
Jolipool1,masalah gimana mau sedia guru 5 agama gaji guru honorer kondisi sekarang masih banyak tidak adil
fahirawin,arti gaji guru honorer 05 digit
D12khard,mau cari uang banyak mending pilih kerja guru mungkin langsung gaji gede istilah awal sokoan honorer dulu kadang tuh lihat masa kerja maksud ngajar berapa tapi kalau kamu langsung guru pns swasta mapan
Guruhonorers,tunjang apa apa kalau guru sekolah negeri bokap baru cerita kata punya kenal guru honorer gitu gaji cuma 180 bulan mau ngelamar sekolah yang swasta fakta mah sender
janghannaaa,memang nyata apa guru honorer rata gaji 1 juta tidak nyampe bahkan guru tk dapet 500 ribu bulan sudah alhamdulillah banget soal rata bawah
namintan,keponakan ku guru honorer gaji 500 ribu bulan bensin motor hari 2 liter pp 24 ribu tiap bulan sumbang negara 220 ribu
FHISIP172393,emang bener gaji guru rendah guru honorer kalau asn memang banyak kamu rumah mobil
Suryo52573671,kayak negara bangkrut ngasih gaji umr guru honorer medit banget dah
zanatul_91,gimana lihat daerah dan daerah guru honorer banyak banget duit dana bos nya sedikit mau mau gaji pun sedikit lagi jumlah siswa makin ganti makin sedikit di sekolah negeri banyak milih sekolah swasta
seokhasbeenhere,memang fakta gitu sender contoh lihat slip gaji honorer seucrit gitu buat hari mau guru
candide09,makan gratis pakai dana bos gaji guru honorer makin
NandaazNafa,besok tanggal 2 kayak terima gaji perlu foto untuk bukti nek gaji guru honorer horor
PostTweet12,nadiem berapa jabat masih bisa kasih gaji layak guru utama guru honorer
dariguruhonorer,semua guru asn semua guru gaji pokok layak dapat tunjang banyak guru gaji bawah 500 ribu bulan sebut guru honorer
emeronLovelyUV,guru honorer gaji 300 ribu rapel 3 bulan
sasiramadhan_,bayang gaji guru honorer indonesiaberapa kali lipat 88 juta
cryslutt666,tidak ngetik begini sembarang ibu sendiri guru honorer aku tau dikit gaji honorer kalau mau banyak tambah ama kerja lagi in case of my mom beliau ngebimbing anak pkl bikin lapor nulis ijazah panitia uji lain
nblkimm,saran anak muda belum punya karir please usah daftar guru memang sih gampang daftar gaji dikit banget kasi keluarga fyi istri jadi guru honorer gaji cuman 15 juta cuma 10 20 gaji di marketing
Guruhonorers,menteri jokowi nih apa apa diurusin padahal yang lebih urgent kayak gaji guru honorer malah ngurusin seragam
dariguruhonorer,padahal tau gmna capek p3k asn tiap ketemu sma teman keluarga guru ngeluh sma bijak sekarang super duper mikir kalau honorer gaji 500 ribu cukup butuh hidup hari tidak oh mana tidak ngerasain tulang punggung sih
Bakdaimsak,mungkin beberapa sekolah jumlah siswa banyak mencover gaji semua guru dengan layak apaka semua sekolah milik siswa banyak harap dapat perhati perintah dan ubah kami guru honorer
toddysolo79,nang lihat guru honorer ni yang gaji 12rb apa sedih sekali
dariguruhonorer,aneh program makan siang sampai pakai dana bos terlalu banget gaji guru honorer berapa lagi makan siang
BlogBayuWin,allah gaji bapa sbgai guru honorer kesel lihat dan milih tani karna lama biayain anak sekolah dari gaji guru dari hasil panen nyawah
kentuuuth,jelas lebih dari gaji guru honorer
heyraaraa,guru asn punya rumah mobil hasil gadai sk bank lebih gaji bulan balik ke setel default aps honorer
HendikC61588,usah denial memang gaji guru rendah apa honorer keluarga isi mayoritas guru bukan pns kerja sekolah swasta bagus jangan harap tahan hidup coba cek punya mobil kerja samping apa inti jangan denial mikir guru sejahtera
HendikC61588,yah banyak mahasiswa nerima kip mobil alphard lexus pajero lain gaji ortunya memang sampe umr anak bilang usaha online ortunya tidak kedetect sama gaji samping ortunya cuma guru yang gaji 200 300 ribu
HendikC61588,coba gaji guru honorer
HendikC61588,sender gatau gaji guru honorer
Sean_Alma,coba sekarang pns guru p3k kontrak 5 dengan gaji 3-4 juta bulan bom potong bulan berapa buat apa sisa dikit apa honorer mentok gede 600-700 kasih baik mau ngajuin tidak gimana 100-300 300-500
amang_utuh70,mbak sepatu chanel nya atas 25 juta an sederhana sekali nakes manggarai gaji 400 600 ribu bulan guru honorer di daerah 300 ribu-1 juta bulan harga sepatu tara gaji 2 mbak so sederhana banget
sandicalla,presiden wakil presiden baru koalisi indonesia maju harap bapak juga pikir maju para guru honorer yang juang cerdas anak bangsa sungguh tidak di kata dengan gaji ikhlas nya
wilkmixwell,kalau memang gitu tsnya suruh ngerevisi dia cuma bilang naikin gaji guru ya embel honorer
meowmeow18_,kerdil kerja lain guru honorer gaji kecil kerjs sekolah samping ada yang guru les ngajar lebih 24 jam minggu asn ada tentu beban ngajar
dariguruhonorer,karena emang fakta apa guru tempat daerah 3t lagi guru honorer bisa gaji cuma 300 ribu doang
wilkmixwell,gaji guru indonesia gantung golong jabat apa sekolah bila sertifikasi lumayan atas 6 juta miris bila status guru honorer cuma kisar 250 ribu maksimal 500 ribu itu bayar rapel tiap bulan
jyhooniee,alas mau guru tamat fkip gaji guru honorer 300 ribu bulan nyari seser nunggu guru senior gantiin ngajar suruh guru senior bikin silabus rpp ppt bahan ajar ini uang gede 1 juta deh kapok 8 yang akhir guru
ifhuangrenjun,gaji guru honorer rendah sender aku guru honorer gaji cuma 500 pun gaji sering tahan malah keluar bulan bulan
naonsiiie,padahal honorer guru negeri masuk pakai ordal eh gilir gaji kecil sok sok rasa sakit
ViralHot5,bener gaji bawah 500 pikir mana bakal susah tahan 1 bulan miris banget gaji guru honorer banding usaha tiap hari semangat semua guru moga semua selalu beri berkah mudah
Pasgor_16b,gaji guru honorer 130 jam 2600000
AriiWibowo18129,itu guru honorer memang guru iya sudah status asn gaji tunjang dapet honorer gimana puluh jadi honorer masih dan gaji masih ada rapel jelas nominal bawah umr bahkan plis sender jangan tutup mata
AriiWibowo18129,1 dollar 16 ribu beras naik naik lulus sarjana 10 15 gaji nakes umk tuntut naik gaji pecat gaji guru honorer bawah umr anak smp bisa kali mahasiswa ptn sanggup biaya kuliah suruh pinjol this is what you call by success
ardxre,sekali turun langsung dah lokasi jangan sapa doang baca artikel demo honorer buka formasi p3k berapa ribu jumlah honorer kira asn gampang guru honorer 15 di gaji layak begini gampang kamu bilang cuma stigma bikin emosi kamu
EmakSoleha,tara sama gaji honorer dalam kalimantan loh gaji segitu diri guru honorer
senjaakuntukamu,gaji guru honorer kaya bayar layak masa gaji honorer sama bayar tukang bangun gede tukang bangun
hujanyangturun_,fakta banyak banget guru masih honorer sudah sepuh tetap dapet gaji bawah umr padahal guru jadi salah kerja sangat puji coba ada guru apa dunia tapi malah pandang rendah
retnosetyow4t,serah guru honorer gimana naik gaji minimal umk tempat
mrimazzz,real min guru honorer tuh gaji cuman ratus ribu kerja tumpuk dia semua syukur syukur bulan turun gaji sering gaji honorer cuman segitu lahap ama kepala sosial
aslich,memang fakta sender mama guru honorer gaji bulan paling banyak 1 juta
ferryeren,sejak anak sekolah sama kepala dusun disaranin anakaku dimasukin dtks kata bisa dapet pkh kip beliau ngeliat yang cuma guru honorer gaji 500 ribu sama suami kerja pabrik air kondisi begini aku tidak mau ambil takut makan hak
qentrunx,ratus nakes pecat demo minta gaji umr guru utama guru honorer gaji ratus ribu bulan itu macet kurs dollar naik banyak kaya raya pegang amanah rakyat tetap sibuk bagi kursi korup lihat ada begini hampir pesimis rasa mau hijrah
del_paijo,honorer memang rendah sender gaji sakit banget asli padahal guru kerja mulia keren gaji sedih banget gaji 250 ribu rapel 3 bulan jangan kan jajan uang ongkos tidak nutup
an_eclipsee,eh kaget nyata sama sama gaji honorer guru
NW1b0,mirip gitu kerja dosen guru honorer beda raka pasti lulus s2 bahkan s3 juga tidak ada pasti karir apa gaji gede negeri memang abai ama tenaga ajar sehat duit lebih banyak hambur ranah politik
MoennybN,sk asn di lapang banyak guru bukan asn alias honorer dapet gaji 1 juta bulan uyuh malah lebih banyak di bawah apa tunjang tertawa
SundaGenXY,gitu dah banyak duit bulan mahasiswa banding gaji guru honorer pada nyata guru memang underpaid di negara cinta kalau guru nuntut gaji layak masyarakat bilang gin pahlawan tanda jasa mau gaji gede
helmi_stbd,kadikbud malu utara janji tetap juang gaji guru honorer belum bayar
menuksutrisno,nilai gaji guru cuman mulut tetangga coba langsung yang guru apa guru honorer biar tau
akugaktuch,guru honorer indonesia hadap dilema kompleks 1 gaji rendah abdi pasti guru honorer sering terima gaji jauh layak meski abdi lama bas mereka paksa cari kerja samping tahan hidup
riyanarthur,miris indonesia gaji art lebih tinggi gaji guru honorer
Survive3Zombie,di wakanda guru ribut terus urus status honorer gaji tidak dengar introspeksi soal kualitas intelektual guru rendah amoral tidak dedikasi bukan panggil jiwa tidak punya perilaku baik panutan henti jadi guru
NADASM__,kenyataanya 22 lulus kuliah guru honorer gaji 2 juta 24 mulai berfikir gaji gin nikah cukup tidak 26 galau lanjut honoren resign 30 nekat nikah sama guru honorer 32 angkat ans 35 hutang 160 juta bank bangun rumah
kucilpung,sma dulu ngajarnya bener malah rata guru honorer pns nya 80 gaji buta
51KDJ49YJH,pandang enteng sekali eh mentang kerja dapa gaji kong cara mau nilai lain kaya apa sih cuma honorer guru penting kerja deng nda minta doi pa kita p tua f
wafaplayground,sd-sma gratis kasih guru honorer kualitas rendah mau pinter mana murid jokowi lantik dpr selalu tuju anggar didik 20 malah mau ngabisin apbn gaji menteri deret staf khusus guna rakyat oke gas oke gas
khaaliidaa,barang liat di korupsi kayak tol mbak apa makan tidak tahan lama makan siang gratis tidak naik gaji guru honorer guru layak hidup baik sarana prasarana sekolah tambah bila pada
terpanggil313,tau gaji guru honorer bang kali nganggap gaki guru honorer tara umr cikarang wajar opini kaya gin sudah tau opini tetap kaya gin sih kek jual malam
OnlyFish69,getu prestasi ada bagus2nya prestasi contoh msk universitas negri gratis gaji guru naik guru honorer sejahtera akhlak adab murid tingkat baik buli buli sekolah ponpes tindak tegas lain ganti seragam 4 what
rehan_bengsin,maaf 42 semua guru masuk honorer hanya asn akar masalah honorer gaji kecil jam ajar biasa rata 25 ribu asn biasa status sosial gaji habis potong gadai sk pnsnya
arkjalu,guru honorer aku tau gaji pokok bawah umr padahal guru sma negri jakarta
lightbeautiful1,pantes isi otak bansos makan gratis bocil naik gaji jabat gaji guru honorer makin cekik
rifqie_sch,lumayan 500 ribu minggu lebih sedih nya guru honorer sama tendik honorer mama guru honor gaji pokok cuma 200 ribu bulan staf 500 ribu bulan mah 1 minggu 500 ribu kali bulan 2 juta ya mumet ngurus 3 anak 1 2 mah mending
archvaaw,lebih kecil gaji guru honorer
TheDarkHalcyon,kayak nyuruh guru pas abis wisuda karna lihat bibi jadi pns jakarta sedang aku di pandeglang 350 ribu itu gaji 3 bulan based story from my friend yang bagai guru honorer
tgyuubearr,sedih banget lihat guru umur honorer ya indonesia gaji guru tuh dikit tahu di brunei gaji guru tuh gede lah hidup di indonesia pns pas banget tambah honorer ada honorer usia segitu sih -
lasio88,visi misi nya naikin gaji jabat guru honorer oke gas pk gas tuju indonesia emas
sopesnoona,iya gila lebih gila gaji guru honorer
yumyluvv,allah lindung guru yang kena jerat pinjol gaji guru honorer bisa hidup layak aamiin mujibasailiin
PanggilAyAja,nemu sih guru honorer kerja tau guru honorer negeri gaji cuma ada 2 pilih 1 sudah masuk dapodik daftar kemdikbud pake dana bos 2 belum masuk dapodik dana sekolah tidak dapodik sekolah jarang honorer beda swasta gaji gimana
getlouud,alesannya 1 tes masuk guru baru masuk honorer susah bahkan kadang goib recruitmentnya 2 masalah gaji topik paling rame dibicarain kalang guru honorer 3 beban administratif meski semua guru sama kadang yang rela dapat jobdesk lebih biar panjang kontrak
sosakanasimiwo,punya kawan pns amburadul penuh utang itu kawan guru honorer guru dedikasi tinggi gaji paling 600 ribu luar biasa sambi jual online juga jangan kalian pikir guru sekarang jelek
wapriliak,banyak tidak mau guru diakivatkan beda gaji sangat tajam guru pns honorer
upilkelabu,gaji guru memang rendah baik asn masih honorer apa kalau jogja golong 4 sudah syukur banget terus punya mobil tuh banyak dari pinjem uang entah pinjol or pinjem bank
xlvhlxv,alfatihah doa semua guru honorer indonesia 1 guru honorer sering terima gaji jauh layak meski abdi lama bas bahkan puluh 2 paksa cari kerja samping tahan hidup
ravitaravita1,dengar baik video guru honorer gaji 200 ribu sini paham
menbalbalan,tidak mandatory spending jadi guru honorer paksa nerima gaji ada itu penting mandatory spending
andit002,dulu pas tau gaji guru honorer ngiranya gaji bisa sampe juta lebih tau
reygultom82,kan memang fakta rendah apa guru honorer jaman majapahit tidak ubah salahin perintah jangan nyalahin yang mandang rendah gaji guru
LofiChetools,haduh tukang jadi akun baru netes pakai permen meyapa usah bicara manis cuma baju adat selesai gaji sejahtera  guru honorer tidak becus atur zonasi ancur main licik duit mikir
bibitmecin,nadiem tidak gaji honorer guru swasta sama kaya umr jakarta
Raizel_820,guru honorer gaji kecil nampaknya cukup karena kerja ikhlas di cukup sama allah gaji sampe 1 digit kadang guru honorer tuh samping banyak 2 3 kerja samping asal kalian tau
thef4cked,guru honorer sudah abdi bas bahkan puluh beneran abdi gaji ada perlu sih angkat langsung ini kadang ken aku negara asn pun mungkin tinggal tahun pensiun
kantidewirizq,banding negara gaji guru indonesia memang rendah apa yang honorer apa yang honorer tk sd
Jenayass,tidak perlu makan kan guru ngapain suruh ikhlas makan gaji apa apa yang honorer bulan 400 ribu bisa hidup
lawu_mountain,siapa sender ayo ngobrol deh sekali kasih lihat slip gaji guru honorer
Anang1945,teman academic manager satu guru sekolah international solo workload gede worth dengan gaji enjoy tuh teman staf honorer sd negeri gaji kecil nyantai workload juga upil
manipulativeisy,alas hal bisa jadi 1 gaji guru cenderung kecil utama masih honorer apa guru bayar rapel borong tiga bulan cashflosw ancur siapa yang kasih pinjam pinjol bank mana mau guru honorer kasih pinjam
Anang1945,gaji guru honorer manusiawi tuju indonesia cemas 2045
k00k3,guru gaji rendah honorer swasta yayasan kecil pns swasta yayasan gede gaji gede
Kalibrasi100,gaji guru honorer tidak berapa sender banyak nyambi buka les rumah anak les rumah lihat jajan jual ponakan anak bu guru halaman jajan deh mother beli tupperware sama bu guru
delightblueday,gaji bagi nakes guru honorer cemas meanwhile gaji dewan banget gaji di rangin dikit nambahin gaji bagi tidak ngaruh banget mereka
Insaninashiroh,moment didik capai an apa tri guru honorer banyak gaji bawah umr tak sangkal ada indeks pinjam pinjol 45 nya guru apa miris susah lelah didik berfikir samping
sarimsr_24,guru lihat berita apa buat manusia kenapa urus gaji honorer pj kepala sosial utama pj kepala sosial sd
Hadib1s4,nadiem hormat mending rombak gaji guru honorer
BambangSaragih3,punya sepupu guru sd cerita dulu gaji cuma 200 300 ribu bulan dia cuma honorer alhamdulillah sekarang dapet gaji 800 ribu bulan mungkin sepupu sudah lama ngajarnya sd
yogazzzt,asli guru honorer sepuh tuh kasi kemarin cerita guru tinggal tes tinggal duluan gaji p3k nya cair asli yang umur sudah 50 tahun gitu langsung angkat gitu ngeliatnya tuh tidak tega
SukaSkinker,gaji lc guru honorer negara apa gitu
absvrditas,siapa laksana perintah nya guru honorer ppk tetap 1 jam ajar berapa 30 ribu bulan 5 jam asumsi tiap minggu 1 jam lebih betul 150 1 bulan 20 jam ajar baru minggu 5 jam ajar jelas awal ppk daerah biasa gaji resmi bulan sepakat waktu cuma 5 jam bulan
ajieenya3,gaji guru apa honorer
ForgasSabo99,guru honorer guru sekolah swasta kecil sekian lulus jurus guru sedikit yang guru pns gaji tunjang sertifikasi bisa sampai 8 juta up
SuramaduJingga,asa anak pgsd baca menfess guru sd cari gaji gede penting ngajar ikhlas sepenuh hati lillahitaala lihat murid nya paham materi sudah neng banget kira smp sma ada guru honorer
BukanMawar12,menteri utang akan buat bijak segala tunggak gaji guru honorer asn bumn wartawan media nasional media lunas juga pasti akan orang yang speakup soal gaji korupsi sila jangan gaji
andy28694567,gaji guru honorer 700 800 bulan sekarang dulu paling tinggi 300 itu bayar dana bos cair arti dapet gaji 6 bulan kalau kalkulasi lama 6 bulan cuma dapet 4 5 juta bukan rendah tapi rendah banget
maheswariPA_,aduh sistem didik masih acak kadut malah sibuk ganti seragam bapakk perata nya selesai kurikulum gaji guru honorer dulu
asweetnight,baru lewat tertawa fakta guru honorer gaji beneran kecil banget tidak jamin kapan honorer harus tau sender ibu guru salah sd daerah beliau cerita gaji honorer 1 bulan cuma bayar 100 ribu
ArekNdeso79,viral video guru honorer tunjuk gaji rupiah 150 ribu bulan warga nyesek sih
dayetdimulai,yang percaya ya ada orang guru honorer smp ngajar bahasa indonesia gaji 1 1 juta terus malam jaga malam kantor ob gaji 2 6 juta biar hidup mesti double job siang malam biar hidup layak ngandelin gaji guru honorer bakal mepet sekali
favserotonin,padahal lulus gaji honorer guru nyampai umr
bedakbayiiik,guru asn memang banyak tunjang kalau honorer emang gaji alakadarnya
harrysofian,nyemoni awak dewe wis rodo bileng mumet sirah apa faktor usia tambah rada memble statementnya bakal hadap bagai soal negara depan ndak makan siang gratis gaji guru honorer naik
rubihmsyh,karena gaji guru honorer banyak di bawah umr sender bahkan kadang potong misal ngajar mapel linear sama kuliah misal jam ajar minggu tidak cukup lagi tingkat gaji honorer provinsi sama kab kota tuh beda
Ahm_Muslim,biaya hidup gede bu compare dong gaji ump umk sesuai pangkat tunjang banyak abcd emaknya kawan guru damai hidup makmur nafkahin anak sama suami anggur mungkin harus dihighlight masih honorer dari
denliciousz,guru tidak cuma asn doang asn p3k kki honorer sekarang tidak lagi daftar asn sudah banyak banget cuma p3k kki honorer jelas beda sama asn gaji tunjang
andy28694567,moga indonesia naikin gaji guru honorer biar hina gin
virgology_,guru asn punya rumah mobil hasil gadai sk bank lebih gaji bulan balik ke setel default aps honorer sender
