username,full_text
namasayasyfaaa,gaji orang guru honorer kota kisar rupiah 1500000 - rupiah 2000000 di kota kecil hanya banyak rupiah 300000 - rupiah 1000000 lagi guru beban urus administrasi banyak lain apresiasi gaji orang guru tidak padan
RacunShopee999,memang banyak gaji rendah sender guru honorer guru status asn p3k mah beda tetap gaji guru indonesia rendah
pj0ngseong,kan memang fakta apa honorer aduh padahal kemarin sempat biar didik gaji guru lebih perhati eh malah pilih yang lain
rahmania48,honorer kak memang gitu hitung gaji honorer anggar bos misal 20 guru honor 20 bagi makin banyak honorer makin sedikit per orang
netytarigan,sender nyokap guru swasta gajih cuma 2 5 juta potong tabung bulan bersih cuma 1 5 juta tertawa gaji guru swasta honorer emang kecil banget teman kalau pns baru deh gaji lambung tinggi tertawa
akungue46826770,padahal rumah itu bukan cuma rebah hari nyuci baju-nyetrika nyuci piring beberes rumah rumah bikin konten kerja juga itu biar gaji kaya guru honorer ini indonesia teman tidak pake seragam tidak kerja nama
NenkCici4,malu sih cuma sedih justru mata lain guru meski honorer pandang padahal asli miris banget kerja bulan gaji bayar cuma minggu mana tepat waktu kadang 2 3 bulan baru gaji boro-boro nabung ongkos boncos
voiceS_Yoongi,sekitar kampung gaji guru honorer paling tinggi 300 ribu kurang manusiawi zaman serba mehongkalo perintah bilang sejahtera rakyat bohong belaka
AlyaKohl,ibu guru honorer lebih 25 gaji nya paling banyak 500 ribu bulan sama ayah suruh henti ngajar ibu bilang cari uang ajar biar ilmu ibu ajar manfaat barokah beliau
Synkysss,fakta gaji guru memang rendah terus semua guru status asn banyak honorer asn guru tidak semua tpg
anakpelikan,bilang gaji guru rendah kadang mandang ngerendahin guru nya sengaja kritik jabat negara masa guru abdi nya gaji dikit banget yang guru honorer gaji lebih parah
Chillaxest,moga perintah lebih peduli sama nasib guru honorer naikin gaji jabat mending naikin gaji guru honorer
zevanganendra,gaji guru honorer kan emang kecil dah kecil sering telat kalau pns mah beda
dariguruhonorer,semua sekolah pake guru tetap banyak honorer sender tau gaji guru tetap yang gimana sekolah kalau guru honorer mah tetap segitu
FaedahPagi,teriak gaji emaknya cuma 3juta ratus sekian mantan honorer kalian akan tau strugglenya guru honorer orang tua kalian guru honorer mamak besar 2 anak status baru angkat pppk sudah capai banget
mojokdotco,memang gaji rendah kocak apa guru honorer guru punya rumah punya mobil tau apa banyak kredit gadai sk gaji asli guru hidup hari saja empot empot
TMIHARINI,capek guru tuh ngurusin anak segitu banyak ada salah dikit guru kena segala macem omongin gaji sesuai kerja berat gaji kecil baik asn apa honorer
fluktuatif,pak oknum kepala sekolah motongin gaji guru honorer tindak kasih sanksi pindahin kaya henti kaya jangan panggil doang sama dinas tidak sanksi ku spill kepala sosial sd mana
noanggio,gaji guru honorer sekolah swasta yayasan andal dapat spp siswa kalau spp sedikit gaji guru sedikit memang tambah donatur yayasan nunggu 3 baru intensif pemkab intensif tidak 1 juta
arrosyid_cahya,btw tau kalau kerja awat rata 700 ribu bulan sama kaya tukang tunggu fotocopyan gaji guru honorer 250 400 ribu bulan tertawa lebih ngenes apa salah kira kira negri wakanda
Muhammad_nsyam,gaji guru honorer rendah tetap guru tuh kerja mulia ngapain malu
oldnicktr,muka camaba ajar snbt mahasiswa sem awal struggle mahasiswa sem tengah culture shock lebaran banyak dulu tugas mahasiswa sem akhir pusing ama ta mahasiswa profesi nakes gaji kecil guru honorer kerja under umr
chusnusuroyyaa,1 triliun teman mending gaji guru honorer
heinnana,hitung matematika ekonomi indonesia masuk gaji guru honorer keluarga bawah umr anggap layak hidup bulan jabat gaji standar indonesia punya lhkpn gendut2 mau lulus s5 tidak akan bisa hitung nilai wajar
yaemiawko,harus malu perintah soal gagal beri gaji layak guru honorer
Sean_Alma,sebenernya tuju banget sama fenomena murid wali murid ngasih hadiah guru kolektif kaya sekarang rame timbul senjang gratifikasi tapi lihat gaji guru utama honorer ya gimanaa cara lgsg guru gantung pada beri
dariguruhonorer,asli mending naikin gaji guru utama honorer naikin gaji jabat ujung ujung duit lari ani ani
jundy_id,nyata memang iya gaji guru indonesia bilang rendah apa guru honorer sayang padahal guru orang banyak jasa nya bangsa perintah lebih sejahtera guru guru
khe9803,memang fakta anjir punya tua jaman guru honorer sampe angkat pns asn di umur 50 enggak mending diem pernah ngerasain gaji bulan 300 ribu kan tidak pernah lihat tua lantang luntung nyari kerja sampe gerd kan
48squadsama,tau kan dulu masalah guru gaji kecil apa yang honorer masak gin harus kasih tau mau edukasi literasi uang kayak apa kalau gaji kecil tidak mempan tetap kurang emosi jadi
liketiramissyou,halah wong gaji guru honorer cuilik lagak banding ojok mbe kuliah kowe wae golek kerja lewih apik rasah ngongkon pasang pie
badutjalanan145,guru honorer kaya gaji 600-800 hak beri mahkota tertawa
hantuuu16_,doa ya mbak ini ambil gaji guru honorer moga lebih biasa 500-600 ribu bisa masak niat ken bagi makan ultahku tanggal 12 april
Remajasehat2,inget pas smk tante jadi guru honorer sekolah tante nunjukin slip gaji nya 2012 gaji bulan sampe 100 ribu tuhan sedih banget liat
bedakbayiiik,fakta emang gitu apa guru honorer underpaid sender mau sudah pns benar gaji harus gede karena itu kerja tidak gampang asal tau kamu lihat guru punya mobil mereka hasil ngandelin gaji guru tidak
zezexixizexi,sedang pikir bijak naikin gaji guru honorer perata umr jam kerja pegawai swasta
zezexixizexi,memang fakta sender lebih banyak guru gaji bilang layak dulu perintah janjiin bakal naik gaji guru honorer mana
Tamaechan_,guru honorer guru biasa guru asn akhir yang punya gaji ples tunjang
AqqilaDinda,guru honorer btw hampir semua guru honorer daerah memang gaji 10000 rupiah jam ajar bagi 6 jam cuma 60 ribu tuntut administrasi banyak tanggung buat didik anak berat kurikulum gonta ganti lain musingin gaji segitu
BruleLecitin,mungkin sih kayak masuk wilayah pasu ekonomi baik ya gede gaji guru honorer berapa sih turut memang lumayan miris fenomena guru honorer
xyflosandria,semua guru asn yang honorer gaji manusiawi bahkan jarang gaji rapel bulan enggak manusiawi
xyflosandria,bukan emang iya dulu janjiin naik gaji guru honorer mana tuh laksana liat
partofaries,padahal asal kalian tau guru honorer sekolah swasta gaji standar guru honorer hitung matematika gaji segitu gabakal buat nutup butuh masya allah gaji segitu selalu buat sampe akhir bulan karna berkah
looctus,semua guru langsung asn nder banyak guru guru honorer gaji nya maaf bilang tidak layak kerja nya serius dapet gaji nya becanda
shinewithmoa14,sumpah gaji guru emang sedikit ya apa swasta biasa gitu tempat umr 51 juta gaji guru honorer 800 ribu
Unknownxxx93,tertawa cara naik gaji jabat hahahahah apakabar gaji guru honorer tertawa
hkmbcz,heran sama masih ngerendahin guru honorer padahal mereka tau guru honorer gaji sedikit masih ikhlas ridho sepenuh hati ngajar anak murid loh semangat semua bapak ibu guru honorer
hkmbcz,wahai hakim mk tugas kalian mk dapat gaji bulan malu kalian guru honorer tugas kalian untuk dapat kaya jangan para koruptor jadi kalian wakil tuhan tegak adil
jsnsvsusiksddbn,abah guru honorer di smp 2008 gasalah beliau guru honorer memang bikin sakit hati banget tiap lihat gaji masuk rekening bayar tiga bulan sekali tiap tahun ada program bulat bikin pusing gaji berapa tuntut main
IAbogeng29340,kalau asn sekarang asn guru ribet guru honorer mah kesi kamu bayangin kuliah mahal s1 gaji 300 800 ribu bulan jobdesk sama bahkan lebih banyak asn beban moral masyarakat orang tua siswa banyak banding sama buruh lulus sma gaji umr protes percuma
tohaulia,turut hapus profesi guru honorer jenis profesi guru honorer sama sekali manusiawi segi gaji bikin atur minimal gaji guru umk deh syarat rekrutmen perlu perhati jangan baru lulus sma suruh ngajar
hateverybodyy,sungguh urgent sekali masalah seragam kurang urgent adalah lengkap sarana prasarana sekolah tambah gaji guru honorer layak baik sekolah yang bocor bahkan mau roboh
viajesry,duit rakyat dipake padahal bayar gaji thr guru honorer subsidi rakyat mampu baik gedung sekolah bayarin keluarga mampu sakit keras lain ya duit rakyat untuk rakyat malah penting pribadi golong
1984Gobul,guru honorer gaji 300 ribu ada laku aksi sampah begini
adeaahmad_a,guru nyaman angkat pns sekarang pppk sedangakan guru honorer gaji gantung sekolah kota yang nyentuh 15 juta desa beda di desa gaji guru nyentuh 600 ribu sudah bagus ntah uang bos spp apa itu
vaabulous_,fakta sender mama ku guru honorer gaji bulan cuma 150 ribu 200 ribu itu kadang bayar
ScFreed0m,gaji guru honorer 3 bulan nih kakak
jevouiz,fatkanya semua gaji guru tinggi banyak rendah apa honorer
cunilcomel,gaji asn 2 3 juta ukt 20 30 juta gimana mau kuliahin anak apa yang cuma guru
jubBraann,guru honorer guru boleh gaji 300 ribu bulan
daredefvil,guru honorer sudah lama resign masih mikir-mikir butuh biaya sekarang jadi guru enak kerja berat gaji ikhlas bahkan teman guru bilang anak jangan jadi guru rencana resign adik lulus sekolah tempat
kj_enthusiast,indonesia guru sd status honorer gaji umr
fakedukseon,banyak gelar spd mau guru mau pns sekarang p3k susah pns anak kuliah dapet ukt golong tinggi honorer beban kerja sama gaji tidak sesuai
boo_minghao_o,gaji guru dosen kan dah banyak banget usah cari masalah sama menteri apa keluarga
Mly17128177,guru honorer tanggung gaji kecil nekat ngaku-ngaku dosen calon mertua untung terima tetap ngenes gaji ngajar tak buat bekal rumah tangga
yosep_far,potret guru sd indonesia cc guru honorer tanggung gaji kecil nekat ngaku-ngaku dosen calon mertua untung terima tetap ngenes gaji ngajar tak buat bekal rumah tangga
cuttiepies_,itu kan jelas tsnya nulis perintah naikin gaji guru arti pns swasta wajib perintah yayasan honorer kan pegawai tetap kalau mau salahin salahin tsnya spesifik maksud
prplbtss,tes cpns susah batas usia aduh susah ngomong sama model begini gws deh moga situ ngerasain guru honorer anak saja deh yang jadi guru honorer biar tau jadi guru honorer gaji berapa selalu nyinyir orang minim kaya
snowiesh,sender tau biar dapet gaji bisa beli mobil guru jungkir balik ikut sertifikasi bagai bagai segmn susah fakta memang gaji guru banding sama beban kerja bom honorer
yourflowerhanna,kau tau gaji guru honorer kan lebih baik diam
veypranne,sender mungkin asn guru punya mobil rumah kamu tau hidup asli gimana saja rumah mobil dari nabung hasil luar gaji tunjang asn lagi yang nama guru honorer yang gaji gantung mood kepala sosial
litaaja,lebih banyak gaji guru honorer bulan
kaazellika_,jawab sama mf sendiri sih sender asn mau gaji jamin masalah asn tidak mudah dan banyak guru kan memang honorer ya
sparkloeeey,usah denial gaji guru memang rendah asn tau asn sulit gimana apa sekarang maksimal usia buat daftar maksimal 35 bayangin usia atas dan honorer usah padahal padahal kalau tau fakta lapang
Lhopitals_,beneran tahu apa mah mancing emosi bagai lulus jurus didik isu soal gaji guru rendah selalu topik diskusi karna guru honorer gaji bayar bulan bulan kamu maen bang pelosok bang tanyain coba gaji guru situ aman tidak
wooaffi,nakes guru honorer gaji ada
jichening,urus dulu gaji guru honorer tidak ngotak mau apa ivan gunawan tri ngurusin baju
NHiyyihlight,gaji guru honorer tiap bulan bisa cuma 1 8 nya dah
wanmesin,ya lihat urgensi anggar besar sangat tepat untuk hal sebut lihat banyak sekolah layak fasilitas utama daerah2 pelosok tambah gaji guru honorer sangat tidak manusiawi 300 ribu pun kena rapel
daegbyu,gimana tapi memang nyata banyak gaji guru honorer rendah
hehe_ajadulu,pandang cuma guru honorer sih jujur memang iya sih gaji guru belum asn tuh jangan hidup keluarga diri sendiri kadang cukup daftar asn saing bejibun syarat tidak mudah alias susah banget
Wassup123p,1 gaji guru honorer iya gaji guru honorer sedikit liat 150000 bahkan lebih banyak guru honorer sekolah domisili dapet 128000 gila saja iya ada ternyat yang dapet gin
scaranauva,guru honorer dia rendahin banyak anak baca nulis ngitung kerja mulia kaya gitu bisa ya bina memang gaji guru honorer rendah bukan salah guru salah sistemasi perintah yang kurang appreciate guru honorer
aouwwdee_,aneh banget gaji guru nakes honorer engap-engapan malah ngasih wakil tidak wakil rakyat uang pensiun umur hidup bener ngabisin anggar negara
y00ngirlll,guru baru tau apa mungkin guru honorer karena tau sendiri indonesia guru honorer gaji 3 bulan sekali tidak salah turunya
kyungsooro,allah padahal banyak guru honorer jauh lebih derita guru influencer mbok anggar pakai naikin gaji guru honorer acara begini 
Choose_anoy,memang rendah dulu sempat honorer ajar bahasa inggris smp 2012 jam 8 ribu alhamdulillah bulan 200 ribu lebih banyak gaji saya dari ajar primagama bulan 18 2 juta sering gantiin guru hadir
batas_ambang,siapa sih ngasih gaji guru honorer kecil
najaejae141402,ajak jadi tajir pls gaji guru honorer benar cekik
ongesaranghae,banding guru asn sama honorer jauh banget jumlah sender memang nerima fakta gaji guru honorer tuh worth dan banding sama biaya kuliah didik
__sasotya,bukan passion emang ngincer materi jangan ambil hitung 44 juta 8 352 juta gaji guru honorer sd swasta 1 5 juta biasa kota 352 15 234 bulan baru balik modal ukt doang kurleb 19 kayak nyicil kpr bom ngitung uang makan kos dana
2ndepiphyllum_,banding berapa berapa nih guru asn sama guru masih honorer nyata luar apa di pelosok guru masih underpaid banget gaji bawah juta tunjang bahkan gaji 13 semua guru sejahtera
MeungjiRoot,padahal anggar event nya buat gaji guru honorer 1
empingcoklat,gaji guru asn tunjang sertifikasi sangat hasil kurang mungkin yang status honorer status honorer memang polemik sudah larang sejak lama perintah pusat diada-adakan perintah daerah
aderr_,dalam tahun kerja narik gerobak sampah gaji lebih gede gaji honorer guru
Ruddytabooty69,guru honorer tanggung totalitas serius ngajar meski gaji sampai rupiah 500 ribu malah musuh anggap bikin repot guru gaji lebih tapi niat ngajar
strongwolfie,serendah itu guru sd sender mau sd smp sma guru tetap guru sekolah negeri sekarang tidak terima honorer gaji asn guru sama mau sd smp sma
ayayayaida,coba lebih banyak lihat dunia sender jangan sosmed mulu bukan dar stigma nyata gaji guru honorer 300 ribu bulan masih kalau guru punya rumah punya mobil coba benar cek darimana dapetnya dana bos bisnis duit pasang duit tua waris gaji
bebas_l,kaget anggota dprd sih enggak terlalu kasi hasil tunjuangan gede pake rusak gedung bangun pakai pajak rakyat gimana guru honorer gaji minim ada thr hati pikir di mana sih anggota dewan kata hormat amit
viorisolmayo,betul sumpah gaji guru honorer sekolah tuh serendah asli makan harus naik gaji guru sendiri hanya didik itu dulu
deeep_seaaaa,mau beli mobil apa coba gaji segitu misal ketemu guru honorer kaya raya punya mobil mungkin memang asal keluarga kaya dia punya usaha kerja dengan gaji gede
haneul_o_o,gaji sudah sertifikasi sekolah bom sertif saya syukur kerja gaji memang paling kasihan guru honorer gaji mampu sekolah bulan 500 ribu dah tinggi tiap 3 bulan insentif pemda tetap saja beban ngajar sama gaji beda
haneul_o_o,gaji guru honorer 500 ribu bulan ngurusin 28 anak 6 24 minggu
_inisiapaa,gaji guru honorer memang sedikit banget anjir fakta lapang kakak honorer paling bulan cuma 400-500
StarRabbit15,kurikulum ada sekarang diterapin benar tuh hasil bagus cuma jadi bagus soal bare minimum penuh fasilitas gaji guru honorer timpang jumlah siswa guru
songparksoe,tolong gaji guru honorer beri perhati lebih yang cerdas anak bangsa
hii_dudeew,kata yang turun muara enim bukit asam gede gitu pltu tapi sering mati lampu mau apa aspek didik sodara guru honorer kota prabumulih hasil minyak gaji 300 ribu bulan pupuk sulit tani karet sawit mau contoh apa
Cungkri46356457,naik gaji guru honorer thr jangan tunda tunda
lzyjj,perangah lihat gaji guru honorer yang 250 ribu bulan allah rabbi
imstrhmwt,suka kasihan lihat guru honorer indonesia gaji nya berapa kadang bayar bayar padahal punya keluarga harus di kasih nafkah
NoturHabibtiiii,sumpah pls gimana cara guru honorer tuh gaji padan bulan terus dapat thr huhu sedih banget padahal berat kerja cuma ngajarin murid
inmydnaaaa,heran sama guru honorer janji apa rela sampai tetap tahan gaji segitu terus gimana ngatur uang
Mbull28748201,tau gaji guru honorer masih muda cara pikir kaya cetak 70an
RossyBmba46,guys jurus didik buruk kan yah iya emang gaji guru honorer dikit kan bakal seleksi cpns lain dan semua jenjang tahap tidak langsung sukses banget gitu loh
twooneputry,kasi sumpah ada kelar nya polemik gaji guru honorer tani nelayan ayo siapa presiden bisa sejahtera 3 profesi tiga profesi pondasi utama dalam negara ibarat bangun turut
Fikfinicky990,bakal kejang kejang kali tau gaji guru honorer 500 ribu bulan ni napak tanah banget liat arogansi sama sekali tidak pernah ngobrol sama kang cilok kang siomay
wooseokyeochin,1 semua guru asn pppk 2 semua guru honorer provinsi 3 semua guru bayar umr kabupaten kota 4 semua guru beri uang tambah kerja tambah 5 semua guru gang lain tambah gaji sisa bayar jam 100 ribu bulan jam ajar
wooeongie,benar jika guru honorer swasta ajak juang dapat hak demo naik gaji takut bahkan dibully guru juga
reeeiiinaaaaa,itu pasang capres cawapres pilih kan begini sampe pas tau gaji guru honorer rendah kaget
nutrisaripandan,tidak beli guru honorer gaji mana uang kan bayar gaji guru honorer
fitafibriani,ya indonesia dulu nyerah negara inggris belanda gitu ujung cuma jadi buruh ini indonesia yang megang belanda minimal gaji buruh rendah 2 digit ni tidak itu gaji nila guru honorer
a_wintersoltice,guru honorer gaji 300 sd 400 ribu bulan
hanandaurf,tiap daerah gaji guru honorer karna gaji guru honorer kan ambil dana bos sekarang perintah ngelarang rekrut guru honorer baru solusi sekarang guru ikut seleksi asn pppk gaji tara kaya pns
sedangmumet_,yogyakarta sekolah swasta jumlah murid dari imbas sekolah kurang pasu biaya operasional bayar gaji guru layak guru honorer sekolah bayar rupiah 20 ribu satu jam ajar bila akumulasi gaji orang
ANorman149750,gaji guru honorer loh harus diperhatiin tuh sih
bukan4non,gaji guru 200 ribu bulan gaji guru honorer sesuai jam ajar ajar bulan
shandrav_,allah kasihan banget lihat semua guru honorer indonesia gara-gara masalah gaji tunjang saudara guru honorer terus kasih tau gaji gaakan cair lama 3 bulan thr ada gila kira tidak butuh biaya hidup
cosmichailey,sekprov malu utara pasti tunggak gaji guru honorer bayar
Andinaja8,ingat naik gaji guru honorer sesuai umk minimal 2 juta andai umk nya rendah tetap yang 2 juta bulan nya
sibuzyii,layak tau gaji itu rendah padahal orang sangat butuh nyokap guru swasta alhamdulillah gaji masuk juta jauh bawah umr kota apa lihat tweet guru bayar 500 ribu bahkan layak 200 an utama honorer
6uckerforpain,sekarang cuma guru pelosok sama honorer gaji kecil justru biasa mereka lebih tulus effortnya lebih murid banyak guru sekarang cukup sejahtera mostly dmi gaji lebih fokus sertifikasi itu seminar ono ngajar ala kadar yang penting target aja
Jungwoo16794723,kakak gaji full kayak maaf honorer guru 24 juta lumayan loh jogja tempat banyak dinas luar kalau bulan 2 berangkat bisa dapet tambah 2 lipat gaji kalau dulu suka ikut jarang banget ikut kerja cuman mau uang kerja mau
cinnamuorolls,sekian debat gaji guru baru sekali nemu dapat snang mas generasi lihat pov tidak satu sisi fakta memang hal atas buat guru honorer gaji yang tidak manusiawi
boombolonee,momen guru honorer menang akhir dapat gaji sertifikasi sorot pasal tujuh nanti kini gaji sertifikasi bayar terima hak
weonjonwooo,kadikbud malu utara janji tetap juang gaji guru honorer belum bayar
RakaiXavier,memang niat guru honorer ngabdi ngapain ribut masalah gaji tidak kuat ngapain maksa
nurika169,aduh tega liat bapak 20 lebih guru honorer misal gabisa dapet gaji gede minimal kasih jamin sejahtera biar pas sudah saat pensiun tetap hidup layak kaya pensiun asn
siomayjoget,gaji guru honorer 2 juta mas beneranapa dar janji
fusahima,yah begini nasib guru honorer gaji bulan bagi dikembaliin sekolah sekarang gaji pemda potong disdik camat
lilylylilac,memang fakta semua dapet tunjang semua punya mobil 2 jadi honorer yang aku beli cuman makan guru dibutuhin diludahin gaji tidak sesuai tanggung
ladyschon,mantan guru honorer tahun tau betapa sangat zolimi negri lagi gaji 3 bulan sekali sering kena potong sama biaya butuh sekolah thr cuma ngandelin yayasan uang lebih ada
wtermelonsgar_,i ll say once and i ll say often berapa kali kurikulum ganti didik mana ajar tidak beri sejahtera layak guru honorer hak pasti kerja gaji layak
Hamdiirawan17,tahu guru honorer gaji under 800 ribu gemeter lihat tweet
aruoian,dari lombok memang gaji guru tuh kecil dan derita sana bahkan sepuh banyak honorer miris banget dulu lihat guru yang sepuh pake motor butut sekolah jual es mambo and hurt me so bad kelar ngajar juga dia langsung ngarit
afinyulia,rokok 48 ribu bungkus hari bulan hampir 15 juta ngerokok tak kenal cuti sama tanggal merah ngalah ngalahi gaji guru honorer hanya 300 ribu 1 okok hidup 5 guru honorer hebat kan okok
irkhamdwi10,guru pns gaji tunjang bagus guru sekolah internasional yang sedih kan gaji guru honorer jelas anggar kaya guru nama bidang didik pasti tidak akan kaya usaha atau pegawai corporate raksasa
MKyoStarlight,usia tua honorer gimana yaaku sma sekali paham pns guru perintah tuh naikin gaji guru honorer jangan gaji jabat
Berryruby5,lihat gaji guru honorer deh
JKT48asa,ppg bro guru lewat ppg jadi honorer gaji kecil
thilunatic,guru swasta gaji kecil sender emang si kecil honorer guru bener kerja serius gaji main
honeyijams,mau jadi guru honorer kan enak orang suruh kerja gaji minim retorika gaji naik mau nunggu kapan
urbbyruto,tertawa banding sekolah swasta negeri berapa banyak banding asn honorer berapa banyak guru jakarta luar jakarta berapa banyak guru cuma ketemu murid gaji kecil mana korupsi itu paling lagi banyak utang lampias murid
mensobarna,sender asn mobil innova reborn anak kuliah top ten doi bapak juragan tebu terus terus terus tidak gitu punya sawah puluh tempat orang mandang gaji guru rendah aku guru honorer seko kabupaten gaji 200 ribu
zxfffrr,padahal gede gaji kuliah timbang sing guru honorer
kopigulaarenx,btw gaji suami guru honorer cuma 11 ada anak 1 bom beli susu diaper jajan anak belum nafas untuk tabung rekreasi tua mau mau ikut kerja gaji di bawah umr karena kerja susah banget cari atas umr
IamHelen22,kamu lihat guru pns nya lihat honorer nya gaji pns sama honorer bagai langit sama bumi
biazn_,harus kuliah terus dosen ganti cuman segitu yang dosen honorer guru kuliah cuman sekali paling banter 2 kali mau kelapa sekolah memang banyak guru honorer gaji cuman segitu bahkan lebih rendah apa yang tua
thesassyo,bukan ngerendahin memang gaji guru tuh kecil apa kalau guru sd sama tk tk dekat rumah guru gaji 50 ribu kalau asn kalau honorer kecil banget tembus guru sekolah swasta bagus gaji bisa gede
agata_sefila,naikin gaji guru honorer teriak
hcahnry,siapa bilang gaji guru pns dikit honorer iya malah lebih sejahtera guru asn kantor coba cek deh gaji tunjang
GYULAXY0_0,ngomong gaji guru rendah karna sebenernya peduli atas adil profesi guru sangat miris indonesia malah aneh singgung arti tidak care ya cuma fokus asn yang jumlah lebih banyak guru honorer
ssoxhe,1 apa kabar kurikulum merdeka 2 apa kabar gaji guru honorer 3 apa kabar ganti seragam 4 apa kabar naik ukt unsoed selamat datang lanjut selamat datang peras
temennyaocil,tabung sering banget teman tanya dia uang saku bulan besar gaji guru honorer ini ponsel mana
SalmaAinunfitr1,gaji pegawai becuk berapa sih lebih kurang guru honorer apa gimana sampe curi
riiiy_a,guru honorer gaji 300 ribu 3 bulan ngajar ahli finansial mana bisa ngatur
AsmoroM22,memang rendah bayangin masa abdi honorer 12 telah angkat gaji bulan cuma 3 5 juta mengcover biaya biaya sudah dikeluarin masih honor gaji 200 ribu buk lagi tugas guru tuh berat kamu lihat bandingin itu sama gaji guru negara
arsadanim,guru honorer gaji berapa entah nyaman banget kerja ku tawar kerja itu tidak minat kecuali kerja menit 5m sih tidak apa tertawa
jen23_luv,timbang nambah puyeng orangtua murid pak nadiem lebih fokus gaji status guru honorer ringan biaya didik anak indonesia lebih banyak kenyam didik lebih tinggicapek banget sama kurikulum ubah
rantsaboutchu,beberapa daerah sekolah gratis sayang program sekolah gratis program populis kepala daerah paham dunia didik dengan anggar sangat mepet salah dampak besar gaji guru utama guru honorer tidak manusiawi
rantsaboutchu,jangan tutup mata masih guru underpaid teman guru honorer 2 gaji underpaid kadang gaji rapel sampe bulan memang kamu kata makan rapel
kalengkong_guan,mamah papah alhamdulillah masuk guru gaji cukup tidak nutup mata di luar masih banyak banget guru gaji kecil apa honorer
Chochosuuu,mending naikin gaji guru honorer
Joonbooster,sender ayo mutualan guru honorer mungkin cocok hidup sengsara gaji di rapel bulan
beartaeby_,sekolah aph negri jadi kerabat dekat guru guru minimal bayar 15 juta jadi honorer gaji 300 ribu
thvblast,jakarta jakarta daerah contoh sulawesi selatan guru honorer gaji 300 ribu 3 bulan
NanonnnD,betul saya cuma kritik urgensi ngrombak seragam padahal lebih banyak lain sistem didik lebih urgent benah contoh ada siswa boleh tinggal kelas sistem gaji guru honorer didik daerah 3t lain bagai kawan kawan
yacultsesat,yang salah guru honorer sekolah swasta gaji 1 2 hari kurang semua nya sudah serba naik
itslalabell,kakaku honorer semenjak lulus sarjana gaji guru kata cuma isi bensin
AKN_46,padahal sn lumayan gaji tunjang liat doang guru honorer lama 18 dan baru ketrima asn pas mau masuk kuliah lama 18 apa iya dapat hikmah tertawa terima tidak gampang bolak balik ikut cpns kalah sama yang fres grad mau
cakraiki,msiih bnyak guru honorer mbak jujur guru honorer utg an dapat gaji bulan biasa itu sekolah negeri sih dapat triwulan sesuai sekolah lebih tepat
