username,full_text
Yusuf51069839,saat anies baswedan naik pimpin dki selaku guru swasta rasa bantu bijak anggar hibah didik khusus guru swasta sekolah negeri mereka terima gaji ump honorer
jinmatcha52,tuju banget bagai guru honorer muda betul sulit guru guru honorer harus juang nafkah keluarga gaji bulan capai 1 juta apa guru honorer laki sudah keluarga bahkan gaji terkadang telat bayar 1 lain
manabay_,kira semua gaji guru gede bos honorer tuh contoh ponakan jadi guru honorer gaji 600 ribu bulan apa huh beli bbm bayar listrik air makan duit 600 ribu kira gede huh otak ku kalau asn kaya pns iya honorer sapa sender pinter
mojokdotco,putus politik si butuh bijak gaji guru honorer banyak butuh biaya banyak di dki guru honorer angkat kki gaji umr bpjs bebas pajak pbb anak nya dapat beasiswa didik cmiiw kurng tau dilanjutin pj
vsoyenaktauuu,kampus ajar potong apa gaji guru honorer
h0xlywins,solusi gaji guru honorer nyari samping kayak lebih tepat guru yang jadi kerja samping
Slowaja3,sender tau tampol pakek sandal swallow mulut honorer gaji lebih parah pns iku gaji daerah masing masing punya mobil lain putar otak butuh penuh guru itu passion kerja layak semua
crmbrle,ngoceh base mending buka google cari data gaji rata guru indonesia sama cari banding jumlah guru asn guru honorer fg jurus guru indonesia coba lihat senjang maaf soal sejahtera guru salty banget emang nyata kecil banget
inspirasion_,yang mampu beli yang bidikmisi kipk guru honorer gaji 300 ribu bulan recommended
Pr1au0J4n9a,guru honorer layak terima zakat masuk golong miskin gaji 350k bulan bayar 3 bulan sekali
Relizaa,gaji guru honorer 500 ribu bulan hadap keluar 38 juta bulan
BroAntony206,guru honorer gaji 150ribu bulan banyak guru overworked ngerjain bos dapodik banyak kurikulum gajelas ada yang dipikirin cuma ganti seragam
Lifetuneup,awal begitu perlu hari bulan bayar bisa cicil kaya gaji guru honorer guru yayasan yah
agungtrainer,nyata mba guru honorer gaji paling mahal kalau negeri 2juta bahkan teman ku yang ngajar smp gaji 600 ribu di tahan sampe 3 bulan
ssieun3004,ah talking about guru apa yang honorer bener bener sedih ngeliatnya gaji berapa allah
daisyluev,wahai pentol korek maen u kurang cuma case putar jakarta doang u tau berapa guru papua terima gaji telat2 berapa honorer yang puluh jadi guru bom angkat daerah 6 juta berapa butuh pokok beban moril berapa gede jabat
hafidzar_,simpel boruto banyak guru honorer terima faktor dalam karena guru banyak tidak bagi ngajar ada cuma staf pustaka duduk doang kerja ngarep gaji tinggi
koganenohikari,gaji gede gimana rela coba gaji nya kaya guru honorer paling masalah malah bantu nyiram bensin
AbbeyNirmala,guru honorer gaji 600 ribu bulan bayar 3 bulan sekali nasib hidup abdi mungkin anggap hidup makan batu kerikil
Nur60697237Siti,bener bulek guru pkn cocok samean penak kerjo nek pabrik ding gaji umk
Dadan_WFauzie,sis no offense kek gaji kuliah lebih gede guru honorer
OCHN,karya 5 anggota dpr pensiun umur hidup fasilitator guru honorer terjang jalan rusak bangun sdm indonesia malah gaji kecil pensiun jelas
Adriana21033305,alhamdulillah kerja gaji gede tutup mata sejahtera guru memang apa sejahtera guru apa guru honorer
y_moane,padahal capres ingin maju didik eh malah pilih makan siang gratis guru honorer makin tidak harga suruh panitia makan siang kerja banyak gaji lawak dream job emang jabat sih apa nanti korupsi halal naik gaji
noir_ontwit,pandang rendah kenyatana banyak gaji guru tidak layak asn jangan tanya gaji kalau honorer mana
Reychan_A,salah instrumen dana bos buat gaji guru honorer mau sunat
dariguruhonorer,kuliah pgsd 4 dengan ipk 39 epekasi gaji min umr realitanya cuman gaji 350 ribu bulan emang bener jadi guru honorer kerja iklas banget tapi kadang ngedumel sih habis bensin
abdrianriz1992,tulis salah nyindir jabat jangan tulis miskin larang sarjana banyak ke trigger tulis jangan guru ukt mahal memang anak guru ukt ugal an gaji guru under 3 juta honorer ukt anak kena imbas 3 juta-
NurRizally,tahan gaji zolim apa tahan gaji guru zolimnya kuadrat pala thr kasi gaji guru honorer bayar alhamdulillah kali
Kays_2017,inget itu gaji guru umr tuh asn ada gaji 13 sama sertifikasi guru honorer sekarang tuh banyak gaji kecil lagi gaji rapel di bayar 3 bulan sekali minimal alas nunggu dana bos
fathonahnazizah,mas banding rata jumpah asn vs guru honorer 15 mas load kerja sama gaji asn tukin lain bulan sampe 8 juta honorer bulan gantung jam ngajar mas rata dapet 800-1jutaan bulan
DediTri37007688,pernah guru honorer kerja serius gaji main alhamdulillah kerja tempat layak moga lulus akmil akpol sekolah dinas yang gaji jamin layak mikirin nasib guru kalian ambisius kuasa bisnis
abyaby1256,gaji 450 ribu solusi literasi uang
sunflowerswill,hai sender orang guru honorer aku mau bilang tidak semua guru punya tunjang profesi asn jumlah guru honorer indonesia bisa bilang besar wajar stigma gaji rendah lekat
milonomnom,karena memang gaji guru rendah sender utama honorer asal tahu sender jumlah lebih banyak guru honorer asn tau karna kerja sekolah rata gaji guru honorer tk daerah 200-500 sd mi 500 1 juta an
luvifah,teman guru honorer gaji awal 100 ribu bulan sekarang naik 600 ribu bulan mana kata itu sekolah benar guru gaji pahala si
fathonahnazizah,cuma tulis guru ram kadang terang guru pns honorer turut benar besar persentase nya gaji guru tuh sedikit bahkan pns itu kadang banyak pikir kuliah aja pns nih paling mahal uktnya
_pRisiLLa,kalian pikir gila yang lebih gila gaji guru honorer 300 ribu bulan begitu moga guru lebih sejahtera depan
fathulmunir50,tuju duit tidak yang mau kelola apa gaji guru p3k 3 juta jateng pns gantung golong kelas kepala sekolah mentok 5 juta apa guru bawah apa honorer
Farida_Khairul,heran sama instansi harus cairin hak guru honorer bisa sampe gaji dah kecil saja rapel padahal ngurusin tukin gaji giat diri saja rajin
himalianana,silah banding jumlah asn guru gaji lebih tinggi butuh jumlah asn honorer hidup gaji bawah keluar butuh
croissanthemoem,dari ngurusin baju gaji guru honorer diperhatilan sistem didik masih semrawut
NikRaVen56829,rata wasit tarkam iku guru honorer jas ambil sertifikat lisensi wasit lumayan gawe samping jadi hasil wasit lewih gede timbang gaji guru
Zulkifly_Ramli,gaji guru honorer gede kok
worthforyouuu,satu ken naikin gaji jabat satu naikin biaya haji terus ada rencana naikin gaji guru honorer umr pabrik gitu
selma_xuxi,jelas gaji guru honorer prihatin
Bangzuber,bener sih sender ibu dulu honorer juta gaji beliau beli butuh sekunder waktu dapet tunjang sekarang kayak lagi tunjang guru honorer cuma gaji pokok apa tunjang tetap ada tapi tidak semua
nuklirterbang,bukankah sama sejak awal kan tau gaji honorer rendah fakta bahwan guru seko penuh tetap banyak oknum datang kasih bisa honor tuju apa sih saya sih pasti tuju murni abdi panggil hati ya bu sekian sehat selalu
jenniekarinayu,gaji guru lihat dulu honorer berapa
jsnsvsusiksddbn,memang iya semua jadi guru dapet gaji minimal umrtunjangan apa honorer bahkan guru honorer yang cuma 150 ribu bulan itu guru yang tajir tuh biasa punya usaha jual contoh buka les
xrnsxx,tertawa diskursus gaji guru honorer vs asn nyaris tiap bulan sudah kaya diskursus soal tom vs summer split bill pas first meet sender misal tarik bahas profesi guru sila dm yes jelasin bingung
Delisa_Lockey,memang rendah sender mamah guru bisa punya rumah sama mobil karena punya suami ayah gaji lumayan tanah waris tinggal bangun rumah sekarang mamah kepala sekolah suka kasi ama guru utama honorer gaji 800 bayar 3 bulan sekali
_davxon,sender nyobain ngelamar guru coba guru paud dulu buar tau gaji honorer berapa sekolah swasta lebih banyak honorer
varldsfreden,turut baik hindar ini gratifikasi kedok thr dalil kasihan diam mk guru ajar gratifikasi gaji guru honorer memang prihatin tugas perintah harus pikir aduh mau nulis banyak jumlah karakter batas
myamoreD,turut si kuliah guru honorer kerja rendah anak disekolahin kan diajarin sama guru tertawa kalian guru honorer kurang puas gaji bukak les rumah temu 50 ribu minggu 2 kali murid 20 lumayan
PhiIIipee,loh kaget lihat gaji guru honorer cuma anak guru 30 anak
maulidalinda714,abis nangisin panda ganti nangisin gaji guru honorer dah mau buka apa capek banget cengeng sudah
allaboutchiz,soal guru ada 3 kategori eh 1 guru honorer gaji sesuai mampu sekolah 2 guru pns p3k tidak punya serdik cuma gaji pokok doang 3 guru pns p3k punya serdik yang sejahtera guru kategori 3 dia gaji pokok tpg
viruus133,sesuai banget sama gaji guru apa honorer tertawa
LexWu_13,guru harus ngadepin anak bandel ada awal gaji berapa pensiun umur hidup juga pns honorer lebih sedih
arsadanim,sudah asn usaha bagai tunjang golong fakta guru swasta guru honorer gaji alakadarnya tau karenya nyokap punya banyak kenal guru masih honorer guru swasta bahkan gaji bulan ada 300 ribu
PadiSandal,kan sering bilang guru pahlawan tanda jasa gaji honorer pun kecil baru lulus kuliah tampar fakta gaji bawah umr mana ikut ppg makanya mau cepet mapan sulit tahap asn nya susah saing banyak
Al_Raeyn,sisi pns guru nakes honorer gaji bulan kena potong pajak biaya sampe nakes bulan cuma terima 600 ribu mana pas demo mang bijak bareng langsung mecat tadi indonesia usah sok agam praktek gin marak
annnxie,pagi honorer guru sore kang tarik gerobak gaji narik gerobak 350 ribu bulan lebih gede gaji guru
varldsfreden,mending merjuangin gaji guru honorer baik sistem kurikulum merdeka ngurus begini tidak penting
